{"query":"context","tab":"top","results":[{"type":"post","id":"1","url":null,"text":"Root post","author":null,"created_at":null,"language":null,"conversation_id":null,"reply_to":null,"metrics":{"replies":null,"reposts":null,"quotes":null,"likes":null,"bookmarks":null,"views":null},"possibly_sensitive":null,"links":[],"mentions":[],"hashtags":[],"cashtags":[],"media":[],"quoted_post":{"type":"post","id":"2","url":null,"text":"Quoted post","author":null,"created_at":null,"language":null,"conversation_id":null,"reply_to":null,"metrics":{"replies":null,"reposts":null,"quotes":null,"likes":null,"bookmarks":null,"views":null},"possibly_sensitive":null,"links":[],"mentions":[],"hashtags":[],"cashtags":[],"media":[{"id":"20","type":"image","url":"https://img.test/quoted.jpg","preview_url":null,"width":null,"height":null,"alt_text":null,"duration_ms":null}],"quoted_post":{"type":"post","id":"3","url":null,"text":"Nested quoted post","author":null,"created_at":null,"language":null,"conversation_id":null,"reply_to":null,"metrics":{"replies":null,"reposts":null,"quotes":null,"likes":null,"bookmarks":null,"views":null},"possibly_sensitive":null,"links":[],"mentions":[],"hashtags":[],"cashtags":[],"media":[],"quoted_post":null,"community_note":null},"community_note":{"id":"note-2","text":"Quoted note","language":null,"sources":[{"url":"https://example.test/quoted","display_url":null}],"url":"https://x.com/i/communitynotes/n/note-2"}},"community_note":{"id":"note-1","text":"Direct note","language":"en","sources":[{"url":"https://example.test/direct","display_url":"example.test/direct"}],"url":"https://x.com/i/communitynotes/n/note-1"}},{"type":"post","id":"4","url":null,"text":"Conversation root","author":null,"created_at":null,"language":null,"conversation_id":"4","reply_to":null,"metrics":{"replies":null,"reposts":null,"quotes":null,"likes":null,"bookmarks":null,"views":null},"possibly_sensitive":null,"links":[],"mentions":[],"hashtags":[],"cashtags":[],"media":[],"quoted_post":null,"community_note":null},{"type":"post","id":"5","url":null,"text":"Conversation reply","author":null,"created_at":null,"language":null,"conversation_id":"4","reply_to":{"post_id":"4","user_id":"9","username":"other"},"metrics":{"replies":null,"reposts":null,"quotes":null,"likes":null,"bookmarks":null,"views":null},"possibly_sensitive":null,"links":[],"mentions":[],"hashtags":[],"cashtags":[],"media":[],"quoted_post":null,"community_note":null}],"next_cursor":null,"warnings":[]}
