{"query":"cats","tab":"media","results":[{"type":"post","id":"2095005406548341158","url":"https://x.com/media_author/status/2095005406548341158","text":"Mixed media post","author":{"id":"1","name":"Media Author","username":"media_author","url":"https://x.com/media_author","avatar_url":null,"verification":null,"protected":null},"created_at":"2026-09-01T21:26:00Z","language":null,"conversation_id":null,"reply_to":null,"metrics":{"replies":null,"reposts":null,"quotes":null,"likes":null,"bookmarks":null,"views":null},"possibly_sensitive":null,"links":[],"mentions":[],"hashtags":[],"cashtags":[],"media":[{"id":"100","type":"image","url":"https://img.test/photo.jpg","preview_url":null,"width":640,"height":480,"alt_text":"A photo","duration_ms":null},{"id":"101","type":"video","url":"https://video.test/high.mp4","preview_url":"https://img.test/video.jpg","width":1920,"height":1080,"alt_text":null,"duration_ms":42000},{"id":"102","type":"animated_gif","url":"https://video.test/gif.mp4","preview_url":"https://img.test/gif.jpg","width":null,"height":null,"alt_text":null,"duration_ms":null}],"quoted_post":null,"community_note":null},{"type":"post","id":"2","url":null,"text":"No media post","author":null,"created_at":null,"language":null,"conversation_id":null,"reply_to":null,"metrics":{"replies":null,"reposts":null,"quotes":null,"likes":null,"bookmarks":null,"views":null},"possibly_sensitive":null,"links":[],"mentions":[],"hashtags":[],"cashtags":[],"media":[],"quoted_post":null,"community_note":null}],"next_cursor":null,"warnings":[]}
